Serial No.,App Category Name,App Name,App Repo Name,App Description
32,Communication & Notification Apps,Email & SMS App UI,danacore-email-sms-ui,"Frontend interface delivering intuitive communication management capabilities. Features include message template builder, scheduling interface, and delivery monitoring dashboard. Implements WYSIWYG template editor with variable placeholder management. Provides tools for recipient list management and delivery scheduling. Includes message preview, test sending, and delivery status tracking. Features include campaign analytics, bounce management, and template library. The interface supports both individual and bulk message operations. Implements role-based access control for communication management."
33,Communication & Notification Apps,Task Notification App API,danacore-task-notification-api,"Backend service providing comprehensive task notification capabilities. Implements sophisticated notification routing engine supporting multiple delivery channels. Features include notification templating, priority management, and delivery scheduling. Supports various notification triggers and conditional routing rules. Implements notification aggregation, batching, and smart delivery timing. The API provides features for notification preferences, delivery confirmation, and reminder scheduling. Includes capabilities for notification analytics and effectiveness tracking. Supports integration with task management systems and communication channels."
34,Communication & Notification Apps,Task Notification App UI,danacore-task-notification-ui,"Frontend interface delivering comprehensive task notification management capabilities. Features include notification preference configuration, delivery channel management, and notification history dashboard. Implements interfaces for notification template customization and priority settings. Provides tools for notification scheduling, recipient management, and delivery tracking. Includes notification preview, testing tools, and effectiveness analytics. Features include notification grouping, smart timing configuration, and notification suppression rules. The interface supports both individual and bulk notification management."
35,Communication & Notification Apps,Collaboration App API,danacore-collaboration-api,"Backend service providing comprehensive team collaboration capabilities. Implements sophisticated real-time communication engine supporting multiple interaction modes. Features include chat messaging, file sharing, and video conferencing management. Supports various collaboration channels and integration points. Implements presence management, notification routing, and message persistence. The API provides features for conversation threading, file versioning, and meeting scheduling. Includes capabilities for search indexing, access control, and activity tracking. Supports integration with external collaboration tools and storage services."
36,Communication & Notification Apps,Collaboration App UI,danacore-collaboration-ui,"Frontend interface delivering intuitive collaboration capabilities with comprehensive communication tools. Features include unified chat interface, file management workspace, and video conferencing controls. Implements real-time message synchronization and presence indicators. Provides tools for file organization, sharing permissions, and version tracking. Includes meeting scheduler, participant management, and screen sharing tools. Features include search functionality, notification preferences, and conversation filtering. The interface supports multiple collaboration modes and device types."
37,Service Apps,Job Scheduler App,danacore-job-scheduler,"Backend service providing comprehensive job scheduling and execution capabilities. Implements sophisticated scheduling engine supporting complex execution patterns and dependencies. Features include job definition, scheduling rules, and execution monitoring. Supports various trigger types including cron expressions, events, and manual triggers. Implements job prioritization, resource management, and parallel execution control. The API provides features for job versioning, parameter management, and execution history. Includes capabilities for error handling, retry policies, and notification integration. Supports distributed execution and high availability deployment."
38,Service Apps,Event Processing App,danacore-event-processing,"Backend service providing sophisticated event processing capabilities with RabbitMQ integration. Implements comprehensive event handling engine supporting various messaging patterns. Features include event routing, transformation, and correlation. Supports publish-subscribe, request-reply, and routing patterns. Implements message persistence, delivery guarantees, and dead letter handling. The API provides features for event tracking, replay capabilities, and performance monitoring. Includes capabilities for event schema management and version control. Supports scalable event processing and fault tolerance."
39,Service Apps,Audit Trail App,danacore-audit-trail,"Backend service providing comprehensive audit logging capabilities with sophisticated tracking features. Implements secure audit trail management supporting various event types and sources. Features include event capture, storage, and retrieval with tamper-evident logging. Supports structured and unstructured audit data with flexible schema. Implements retention policies, archival rules, and compliance reporting. The API provides features for audit search, filtering, and export capabilities. Includes tools for audit analysis, pattern detection, and compliance monitoring. Supports integration with security information and event management (SIEM) systems."
